{
  "$schema": "http://json-schema.org/draft-04/schema#",
  "title": "Opening",
  "type": "object",
  "description": "Descriptor an opening period.",
  "properties": {
    "id": {
      "type": "string",
      "description": "Period's internal id."
    },
    "servicePointId": {
      "type": "string",
      "description": "Service point ID."
    },
    "name": {
      "type": "string",
      "description": "Name of the period"
    },
    "startDate": {
      "type": "string",
      "format": "date-time",
      "description": "Start date of the period."
    },
    "endDate": {
      "type": "string",
      "format": "date-time",
      "description": "End date of the period."
    },
    "openingDays": {
      "type": "array",
      "description": "List opening hours within the period.",
      "items": {
        "type": "object",
        "$ref": "OpeningDayIncludeWeekdays.json"
      }
    }
  },
  "additionalProperties": false,
  "required": [
    "startDate"
  ]
}
