{
  "id": "33333333-3333-3333-3333-333333333333",
  "servicePointId": "3a40852d-49fd-4df2-a1f9-6e2641a6e91f",
  "name": "December 5 through 31",
  "startDate": "2021-12-05",
  "endDate": "2021-12-31",
  "openingDays": [
    {
      "weekdays": {
        "day": "MONDAY"
      },
      "openingDay": {
        "openingHour": [
          {
            "startTime": "07:30",
            "endTime": "17:30"
          }
        ],
        "allDay": false,
        "open": true
      }
    },
    {
      "weekdays": {
        "day": "TUESDAY"
      },
      "openingDay": {
        "openingHour": [
          {
            "startTime": "07:30",
            "endTime": "17:30"
          }
        ],
        "allDay": false,
        "open": true
      }
    },
    {
      "weekdays": {
        "day": "WEDNESDAY"
      },
      "openingDay": {
        "openingHour": [
          {
            "startTime": "00:00",
            "endTime": "23:59"
          }
        ],
        "allDay": true,
        "open": true
      }
    },
    {
      "weekdays": {
        "day": "THURSDAY"
      },
      "openingDay": {
        "openingHour": [
          {
            "startTime": "07:30",
            "endTime": "17:30"
          }
        ],
        "allDay": false,
        "open": true
      }
    },
    {
      "weekdays": {
        "day": "FRIDAY"
      },
      "openingDay": {
        "openingHour": [
          {
            "startTime": "07:30",
            "endTime": "17:30"
          }
        ],
        "allDay": false,
        "open": true
      }
    },
    {
      "weekdays": {
        "day": "SATURDAY"
      },
      "openingDay": {
        "openingHour": [
          {
            "startTime": "07:00",
            "endTime": "12:00"
          },
          {
            "startTime": "13:30",
            "endTime": "20:00"
          }
        ],
        "allDay": false,
        "open": true
      }
    }
  ]
}
