{
  "id": "11111111-1111-1111-1111-111111111111",
  "servicePointId": "3a40852d-49fd-4df2-a1f9-6e2641a6e91f",
  "name": "Finals Extra Opening",
  "startDate": "2021-12-11",
  "endDate": "2021-12-17",
  "openingDays": [
    {
      "openingDay": {
        "openingHour": [
          {
            "startTime": "02:00",
            "endTime": "23:00"
          }
        ],
        "open": true
      }
    }
  ]
}
