{
  "id": "00000000-0000-0000-0000-000000000000",
  "servicePointId": "3a40852d-49fd-4df2-a1f9-6e2641a6e91f",
  "name": "Christmas Closure",
  "startDate": "2021-12-24",
  "endDate": "2021-12-25",
  "openingDays": [
    {
      "openingDay": {
        "openingHour": [
          {
            "startTime": "00:00",
            "endTime": "23:59"
          }
        ],
        "allDay": true,
        "open": false
      }
    }
  ]
}
